{"host_protocol":"static-json-query-schema-submit-v2","path_base":"task_root","required_call_schedule":["query_greeks_underlying_market_v2","query_greeks_option_quotes_v2","submit_greeks_submission_v2"],"resource_budget":{"submission_bytes":5242880,"submission_calls":1,"trusted_query_calls":2},"task_id":"bsm-mig-v2-ca9ba5123aedad2e99bfea40","tools":[{"arguments_schema":{"additionalProperties":false,"maxProperties":0,"type":"object"},"kind":"static_json_query","max_calls":1,"name":"query_greeks_underlying_market_v2","payload_digest":"a3469d812e0a3eec08505ab964ec2c0c5ce896812ab7aa6e7dcd037a6aa96399","payload_path":"trusted_tools/payloads/underlyings.json"},{"arguments_schema":{"additionalProperties":false,"maxProperties":0,"type":"object"},"kind":"static_json_query","max_calls":1,"name":"query_greeks_option_quotes_v2","payload_digest":"0a14cb540d4bc1b86245b314b968714130f8921a3dd947619fdec0a7623d4c44","payload_path":"trusted_tools/payloads/options.json"},{"canonical_serialization":"utf8-sort-keys-compact-newline-v1","kind":"schema_validated_submission_sink","max_calls":1,"name":"submit_greeks_submission_v2","row_id_sequence_constraint":{"contiguous":true,"decimal_width":6,"increment":1,"prefix":"row_","row_id_field":"row_id","rows_field":"rows","start":1},"submission_schema_dialect":"https://json-schema.org/draft/2020-12/schema","submission_schema_digest":"bcd31ab0fb1c40d0a4480d60aa2775595a84a62aa3d0c4515cccda82a5d385e3","submission_schema_path":"evaluation_view/public/submission.schema.json","task_id_constraint":"bsm-mig-v2-ca9ba5123aedad2e99bfea40"}],"toolset_schema_version":"bsm-greeks-portable-toolset-v2.0.0"}
