{"host_protocol":"static-json-query-schema-submit-v2","path_base":"task_root","required_call_schedule":["query_greeks_underlying_market_v2","query_greeks_option_quotes_v2","submit_greeks_submission_v2"],"resource_budget":{"submission_bytes":5242880,"submission_calls":1,"trusted_query_calls":2},"task_id":"bsm-mig-v2-2ab838dd3c43d6f08a06ab99","tools":[{"arguments_schema":{"additionalProperties":false,"maxProperties":0,"type":"object"},"kind":"static_json_query","max_calls":1,"name":"query_greeks_underlying_market_v2","payload_digest":"52896dd780a471f5a045d7ca656a03a42283b2e830a98afa09cafe5741cf822d","payload_path":"trusted_tools/payloads/underlyings.json"},{"arguments_schema":{"additionalProperties":false,"maxProperties":0,"type":"object"},"kind":"static_json_query","max_calls":1,"name":"query_greeks_option_quotes_v2","payload_digest":"83456fb6ddd220e181373c17d451dc5a9501e1fb2e529f44d5ab4023b104cdb3","payload_path":"trusted_tools/payloads/options.json"},{"canonical_serialization":"utf8-sort-keys-compact-newline-v1","kind":"schema_validated_submission_sink","max_calls":1,"name":"submit_greeks_submission_v2","row_id_sequence_constraint":{"contiguous":true,"decimal_width":6,"increment":1,"prefix":"row_","row_id_field":"row_id","rows_field":"rows","start":1},"submission_schema_dialect":"https://json-schema.org/draft/2020-12/schema","submission_schema_digest":"bcd31ab0fb1c40d0a4480d60aa2775595a84a62aa3d0c4515cccda82a5d385e3","submission_schema_path":"evaluation_view/public/submission.schema.json","task_id_constraint":"bsm-mig-v2-2ab838dd3c43d6f08a06ab99"}],"toolset_schema_version":"bsm-greeks-portable-toolset-v2.0.0"}
